{
  "schema": "famtutor.math.document.v1",
  "documentId": "transformations-demo",
  "revision": 1,
  "seed": 19,
  "metadata": {
    "title": "二维几何变换",
    "locale": "zh-CN",
    "purpose": "demonstration",
    "subject": "mathematics",
    "grade": "grade-8",
    "tags": ["translation", "rotation", "reflection", "dilation"]
  },
  "entities": [
    { "id": "O", "type": "point2", "label": "O", "role": "free" },
    { "id": "A", "type": "point2", "label": "A", "role": "free" },
    { "id": "B", "type": "point2", "label": "B", "role": "free" },
    { "id": "v", "type": "vector2", "label": "v", "role": "derived" },
    { "id": "T", "type": "point2", "label": "T", "role": "derived" },
    { "id": "R", "type": "point2", "label": "R", "role": "derived" },
    { "id": "axis", "type": "line2", "label": "l", "role": "auxiliary" },
    { "id": "F", "type": "point2", "label": "F", "role": "derived" },
    { "id": "D", "type": "point2", "label": "D", "role": "derived" },
    { "id": "shape", "type": "polygon2", "role": "derived" },
    { "id": "theta", "type": "angle", "label": "θ", "role": "measurement" },
    { "id": "distanceOT", "type": "scalar", "role": "measurement" },
    { "id": "axisSlope", "type": "scalar", "role": "measurement" }
  ],
  "construction": [
    { "id": "op-O", "command": "point.free", "params": { "coords": [0, 0] }, "outputs": ["O"] },
    { "id": "op-A", "command": "point.free", "params": { "coords": [2.2, 1.1] }, "outputs": ["A"] },
    { "id": "op-B", "command": "point.free", "params": { "coords": [1, 3.2] }, "outputs": ["B"] },
    { "id": "op-v", "command": "vector.between_points", "inputs": [{ "ref": "O" }, { "ref": "B" }], "outputs": ["v"] },
    { "id": "op-T", "command": "transform.translate_point", "inputs": [{ "ref": "A" }, { "ref": "v" }], "outputs": ["T"] },
    { "id": "op-R", "command": "transform.rotate_point", "inputs": [{ "ref": "A" }, { "ref": "O" }], "params": { "angle": "pi/3" }, "outputs": ["R"] },
    { "id": "op-axis", "command": "line.through_points", "inputs": [{ "ref": "O" }, { "ref": "B" }], "outputs": ["axis"] },
    { "id": "op-F", "command": "transform.reflect_point_line", "inputs": [{ "ref": "A" }, { "ref": "axis" }], "outputs": ["F"] },
    { "id": "op-D", "command": "transform.dilate_point", "inputs": [{ "ref": "A" }, { "ref": "O" }], "params": { "factor": 1.6 }, "outputs": ["D"] },
    { "id": "op-shape", "command": "polygon.vertices", "inputs": [{ "ref": "A" }, { "ref": "T" }, { "ref": "R" }, { "ref": "F" }, { "ref": "D" }], "outputs": ["shape"] },
    { "id": "op-theta", "command": "angle.three_points", "inputs": [{ "ref": "A" }, { "ref": "O" }, { "ref": "R" }], "outputs": ["theta"] },
    { "id": "op-distance", "command": "measurement.distance", "inputs": [{ "ref": "O" }, { "ref": "T" }], "outputs": ["distanceOT"] },
    { "id": "op-slope", "command": "measurement.slope", "inputs": [{ "ref": "axis" }], "outputs": ["axisSlope"] }
  ],
  "views": [
    {
      "id": "main",
      "kind": "graphics2d",
      "visible": true,
      "renderer": "jsxgraph-svg",
      "boundingBox": [-6, 7, 8, -5],
      "axes": true,
      "grid": false,
      "keepAspectRatio": true,
      "cameraPolicy": "document"
    }
  ],
  "styles": [
    { "targets": ["shape"], "style": { "token": "accent", "fillOpacity": 0.12, "strokeWidth": 2.5 } },
    { "targets": ["axis"], "style": { "token": "auxiliary", "dash": "dashed" } },
    { "targets": ["T", "R", "F", "D"], "style": { "token": "accent" } }
  ],
  "interactions": [
    { "target": "O", "permissions": ["select", "drag"] },
    { "target": "A", "permissions": ["select", "drag"] },
    { "target": "B", "permissions": ["select", "drag"] }
  ],
  "assertions": [
    { "id": "rotation-angle", "predicate": "expression_equal", "arguments": [{ "expr": "value(theta)" }, { "value": 1.0471975511965976 }], "tolerance": 1e-9 },
    { "id": "positive-distance", "predicate": "value_in_range", "arguments": [{ "ref": "distanceOT" }, { "value": 0.01 }, { "value": 100 }], "tolerance": 0 }
  ],
  "provenance": { "generator": "agent", "createdAt": "2026-08-03T00:00:00Z" }
}
